{
  "task_id": "sympy__sympy-23262",
  "repo_url": "https://github.com/sympy/sympy.git",
  "repo_ref": "fdc707f73a65a429935c01532cd3970d3355eab6",
  "workdir": "/tmp/swebench_work/sympy__sympy-23262",
  "issue_text": "Python code printer not respecting tuple with one element\nHi,\r\n\r\nThanks for the recent updates in SymPy! I'm trying to update my code to use SymPy 1.10 but ran into an issue with the Python code printer. MWE:\r\n\r\n\r\n```python\r\nimport inspect\r\nfrom sympy import lambdify\r\n\r\ninspect.getsource(lambdify([], tuple([1])))\r\n```\r\nSymPy 1.9 and under outputs:\r\n```\r\n'def _lambdifygenerated():\\n    return (1,)\\n'\r\n```\r\n\r\nBut SymPy 1.10 gives\r\n\r\n```\r\n'def _lambdifygenerated():\\n    return (1)\\n'\r\n```\r\nNote the missing comma after `1` that causes an integer to be returned instead of a tuple. \r\n\r\nFor tuples with two or more elements, the generated code is correct:\r\n```python\r\ninspect.getsource(lambdify([], tuple([1, 2])))\r\n```\r\nIn SymPy  1.10 and under, outputs:\r\n\r\n```\r\n'def _lambdifygenerated():\\n    return (1, 2)\\n'\r\n```\r\nThis result is expected.\r\n\r\nNot sure if this is a regression. As this breaks my program which assumes the return type to always be a tuple, could you suggest a workaround from the code generation side? Thank you. \n",
  "hints": {
    "failing_tests": [
      "test_issue_14941"
    ],
    "focus_files": [
      "sympy/utilities/lambdify.py"
    ],
    "test_patch": "diff --git a/sympy/utilities/tests/test_lambdify.py b/sympy/utilities/tests/test_lambdify.py\n--- a/sympy/utilities/tests/test_lambdify.py\n+++ b/sympy/utilities/tests/test_lambdify.py\n@@ -1192,6 +1192,8 @@ def test_issue_14941():\n     # test tuple\n     f2 = lambdify([x, y], (y, x), 'sympy')\n     assert f2(2, 3) == (3, 2)\n+    f2b = lambdify([], (1,))  # gh-23224\n+    assert f2b() == (1,)\n \n     # test list\n     f3 = lambdify([x, y], [y, x], 'sympy')\n"
  },
  "commands": {
    "setup": [
      "pip install -e ."
    ],
    "test_quick": "python -m pytest -x -q -k \"test_issue_14941\"",
    "test_full": "python -m pytest -x -q -k \"test_issue_14941\""
  },
  "limits": {
    "max_iters": 8,
    "max_patch_bytes": 250000,
    "max_files_touched": 15,
    "max_new_files": 5,
    "max_runtime_sec": 1800
  }
}
