{
  "task_id": "django__django-13265",
  "repo_url": "https://github.com/django/django.git",
  "repo_ref": "b2b0711b555fa292751763c2df4fe577c396f265",
  "workdir": "/tmp/swebench_work/django__django-13265",
  "issue_text": "AlterOrderWithRespectTo() with ForeignKey crash when _order is included in Index().\nDescription\n\t\n\tclass Meta:\n\t\tdb_table = 'look_image'\n\t\torder_with_respect_to = 'look'\n\t\tindexes = [\n\t\t\tmodels.Index(fields=['look', '_order']),\n\t\t\tmodels.Index(fields=['created_at']),\n\t\t\tmodels.Index(fields=['updated_at']),\n\t\t]\nmigrations.CreateModel(\n\t\t\tname='LookImage',\n\t\t\tfields=[\n\t\t\t\t('id', models.AutoField(auto_created=True, primary_key=True, serialize=False, verbose_name='ID')),\n\t\t\t\t('look', models.ForeignKey(on_delete=django.db.models.deletion.CASCADE, related_name='images', to='posts.Look', verbose_name='LOOK')),\n\t\t\t\t('image_url', models.URLField(blank=True, max_length=10000, null=True)),\n\t\t\t\t('image', models.ImageField(max_length=2000, upload_to='')),\n\t\t\t\t('deleted', models.DateTimeField(editable=False, null=True)),\n\t\t\t\t('created_at', models.DateTimeField(auto_now_add=True)),\n\t\t\t\t('updated_at', models.DateTimeField(auto_now=True)),\n\t\t\t],\n\t\t),\n\t\tmigrations.AddIndex(\n\t\t\tmodel_name='lookimage',\n\t\t\tindex=models.Index(fields=['look', '_order'], name='look_image_look_id_eaff30_idx'),\n\t\t),\n\t\tmigrations.AddIndex(\n\t\t\tmodel_name='lookimage',\n\t\t\tindex=models.Index(fields=['created_at'], name='look_image_created_f746cf_idx'),\n\t\t),\n\t\tmigrations.AddIndex(\n\t\t\tmodel_name='lookimage',\n\t\t\tindex=models.Index(fields=['updated_at'], name='look_image_updated_aceaf9_idx'),\n\t\t),\n\t\tmigrations.AlterOrderWithRespectTo(\n\t\t\tname='lookimage',\n\t\t\torder_with_respect_to='look',\n\t\t),\nI added orders_with_respect_to in new model class's Meta class and also made index for '_order' field by combining with other field. And a new migration file based on the model looks like the code above.\nThe problem is operation AlterOrderWithRespectTo after AddIndex of '_order' raising error because '_order' field had not been created yet.\nIt seems to be AlterOrderWithRespectTo has to proceed before AddIndex of '_order'.\n",
  "hints": {
    "failing_tests": [
      "test_add_model_order_with_respect_to_index_constraint (migrations.test_autodetector.AutodetectorTests)",
      "test_add_model_order_with_respect_to_index_foo_together (migrations.test_autodetector.AutodetectorTests)",
      "test_set_alter_order_with_respect_to_index_constraint_foo_together (migrations.test_autodetector.AutodetectorTests)",
      "test_supports_functools_partial (migrations.test_autodetector.AutodetectorTests)"
    ],
    "focus_files": [
      "django/db/migrations/autodetector.py"
    ],
    "test_patch": "diff --git a/tests/migrations/test_autodetector.py b/tests/migrations/test_autodetector.py\n--- a/tests/migrations/test_autodetector.py\n+++ b/tests/migrations/test_autodetector.py\n@@ -2151,6 +2151,115 @@ def test_add_model_order_with_respect_to(self):\n         )\n         self.assertNotIn(\"_order\", [name for name, field in changes['testapp'][0].operations[0].fields])\n \n+    def test_add_model_order_with_respect_to_index_foo_together(self):\n+        changes = self.get_changes([], [\n+            self.book,\n+            ModelState('testapp', 'Author', [\n+                ('id', models.AutoField(primary_key=True)),\n+                ('name', models.CharField(max_length=200)),\n+                ('book', models.ForeignKey('otherapp.Book', models.CASCADE)),\n+            ], options={\n+                'order_with_respect_to': 'book',\n+                'index_together': {('name', '_order')},\n+                'unique_together': {('id', '_order')},\n+            }),\n+        ])\n+        self.assertNumberMigrations(changes, 'testapp', 1)\n+        self.assertOperationTypes(changes, 'testapp', 0, ['CreateModel'])\n+        self.assertOperationAttributes(\n+            changes,\n+            'testapp',\n+            0,\n+            0,\n+            name='Author',\n+            options={\n+                'order_with_respect_to': 'book',\n+                'index_together': {('name', '_order')},\n+                'unique_together': {('id', '_order')},\n+            },\n+        )\n+\n+    def test_add_model_order_with_respect_to_index_constraint(self):\n+        tests = [\n+            (\n+                'AddIndex',\n+                {'indexes': [\n+                    models.Index(fields=['_order'], name='book_order_idx'),\n+                ]},\n+            ),\n+            (\n+                'AddConstraint',\n+                {'constraints': [\n+                    models.CheckConstraint(\n+                        check=models.Q(_order__gt=1),\n+                        name='book_order_gt_1',\n+                    ),\n+                ]},\n+            ),\n+        ]\n+        for operation, extra_option in tests:\n+            with self.subTest(operation=operation):\n+                after = ModelState('testapp', 'Author', [\n+                    ('id', models.AutoField(primary_key=True)),\n+                    ('name', models.CharField(max_length=200)),\n+                    ('book', models.ForeignKey('otherapp.Book', models.CASCADE)),\n+                ], options={\n+                    'order_with_respect_to': 'book',\n+                    **extra_option,\n+                })\n+                changes = self.get_changes([], [self.book, after])\n+                self.assertNumberMigrations(changes, 'testapp', 1)\n+                self.assertOperationTypes(changes, 'testapp', 0, [\n+                    'CreateModel', operation,\n+                ])\n+                self.assertOperationAttributes(\n+                    changes,\n+                    'testapp',\n+                    0,\n+                    0,\n+                    name='Author',\n+                    options={'order_with_respect_to': 'book'},\n+                )\n+\n+    def test_set_alter_order_with_respect_to_index_constraint_foo_together(self):\n+        tests = [\n+            (\n+                'AddIndex',\n+                {'indexes': [\n+                    models.Index(fields=['_order'], name='book_order_idx'),\n+                ]},\n+            ),\n+            (\n+                'AddConstraint',\n+                {'constraints': [\n+                    models.CheckConstraint(\n+                        check=models.Q(_order__gt=1),\n+                        name='book_order_gt_1',\n+                    ),\n+                ]},\n+            ),\n+            ('AlterIndexTogether', {'index_together': {('name', '_order')}}),\n+            ('AlterUniqueTogether', {'unique_together': {('id', '_order')}}),\n+        ]\n+        for operation, extra_option in tests:\n+            with self.subTest(operation=operation):\n+                after = ModelState('testapp', 'Author', [\n+                    ('id', models.AutoField(primary_key=True)),\n+                    ('name', models.CharField(max_length=200)),\n+                    ('book', models.ForeignKey('otherapp.Book', models.CASCADE)),\n+                ], options={\n+                    'order_with_respect_to': 'book',\n+                    **extra_option,\n+                })\n+                changes = self.get_changes(\n+                    [self.book, self.author_with_book],\n+                    [self.book, after],\n+                )\n+                self.assertNumberMigrations(changes, 'testapp', 1)\n+                self.assertOperationTypes(changes, 'testapp', 0, [\n+                    'AlterOrderWithRespectTo', operation,\n+                ])\n+\n     def test_alter_model_managers(self):\n         \"\"\"\n         Changing the model managers adds a new operation.\n"
  },
  "commands": {
    "setup": [
      "pip install -e .[argon2,bcrypt]"
    ],
    "test_quick": "python -m pytest -x -q migrations/test_autodetector.py",
    "test_full": "python -m pytest -x -q migrations/test_autodetector.py"
  },
  "limits": {
    "max_iters": 8,
    "max_patch_bytes": 250000,
    "max_files_touched": 15,
    "max_new_files": 5,
    "max_runtime_sec": 1800
  }
}
