{
  "task_id": "pytest-dev__pytest-5692",
  "repo_url": "https://github.com/pytest-dev/pytest.git",
  "repo_ref": "29e336bd9bf87eaef8e2683196ee1975f1ad4088",
  "workdir": "/tmp/swebench_work/pytest-dev__pytest-5692",
  "issue_text": "Hostname and timestamp properties in generated JUnit XML reports\nPytest enables generating JUnit XML reports of the tests.\r\n\r\nHowever, there are some properties missing, specifically `hostname` and `timestamp` from the `testsuite` XML element. Is there an option to include them?\r\n\r\nExample of a pytest XML report:\r\n```xml\r\n<?xml version=\"1.0\" encoding=\"utf-8\"?>\r\n<testsuite errors=\"0\" failures=\"2\" name=\"check\" skipped=\"0\" tests=\"4\" time=\"0.049\">\r\n\t<testcase classname=\"test_sample.TestClass\" file=\"test_sample.py\" line=\"3\" name=\"test_addOne_normal\" time=\"0.001\"></testcase>\r\n\t<testcase classname=\"test_sample.TestClass\" file=\"test_sample.py\" line=\"6\" name=\"test_addOne_edge\" time=\"0.001\"></testcase>\r\n</testsuite>\r\n```\r\n\r\nExample of a junit XML report:\r\n```xml\r\n<?xml version=\"1.0\" encoding=\"UTF-8\"?>\r\n<testsuite name=\"location.GeoLocationTest\" tests=\"2\" skipped=\"0\" failures=\"0\" errors=\"0\" timestamp=\"2019-04-22T10:32:27\" hostname=\"Anass-MacBook-Pro.local\" time=\"0.048\">\r\n  <properties/>\r\n  <testcase name=\"testIoException()\" classname=\"location.GeoLocationTest\" time=\"0.044\"/>\r\n  <testcase name=\"testJsonDeserialization()\" classname=\"location.GeoLocationTest\" time=\"0.003\"/>\r\n  <system-out><![CDATA[]]></system-out>\r\n  <system-err><![CDATA[]]></system-err>\r\n</testsuite>\r\n```\n",
  "hints": {
    "failing_tests": [
      "testing/test_junitxml.py::TestPython::test_hostname_in_xml",
      "testing/test_junitxml.py::TestPython::test_timestamp_in_xml"
    ],
    "focus_files": [],
    "test_patch": "diff --git a/testing/test_junitxml.py b/testing/test_junitxml.py\n--- a/testing/test_junitxml.py\n+++ b/testing/test_junitxml.py\n@@ -1,4 +1,6 @@\n import os\n+import platform\n+from datetime import datetime\n from xml.dom import minidom\n \n import py\n@@ -139,6 +141,30 @@ def test_xpass():\n         node = dom.find_first_by_tag(\"testsuite\")\n         node.assert_attr(name=\"pytest\", errors=1, failures=2, skipped=1, tests=5)\n \n+    def test_hostname_in_xml(self, testdir):\n+        testdir.makepyfile(\n+            \"\"\"\n+            def test_pass():\n+                pass\n+        \"\"\"\n+        )\n+        result, dom = runandparse(testdir)\n+        node = dom.find_first_by_tag(\"testsuite\")\n+        node.assert_attr(hostname=platform.node())\n+\n+    def test_timestamp_in_xml(self, testdir):\n+        testdir.makepyfile(\n+            \"\"\"\n+            def test_pass():\n+                pass\n+        \"\"\"\n+        )\n+        start_time = datetime.now()\n+        result, dom = runandparse(testdir)\n+        node = dom.find_first_by_tag(\"testsuite\")\n+        timestamp = datetime.strptime(node[\"timestamp\"], \"%Y-%m-%dT%H:%M:%S.%f\")\n+        assert start_time <= timestamp < datetime.now()\n+\n     def test_timing_function(self, testdir):\n         testdir.makepyfile(\n             \"\"\"\n"
  },
  "commands": {
    "setup": [
      "pip install -e .[testing]"
    ],
    "test_quick": "python -m pytest -x -q testing/test_junitxml.py::TestPython::test_hostname_in_xml testing/test_junitxml.py::TestPython::test_timestamp_in_xml",
    "test_full": "python -m pytest -x -q testing/test_junitxml.py::TestPython::test_hostname_in_xml testing/test_junitxml.py::TestPython::test_timestamp_in_xml"
  },
  "limits": {
    "max_iters": 8,
    "max_patch_bytes": 250000,
    "max_files_touched": 15,
    "max_new_files": 5,
    "max_runtime_sec": 1800
  }
}
