{
  "task_id": "django__django-11039",
  "repo_url": "https://github.com/django/django.git",
  "repo_ref": "d5276398046ce4a102776a1e67dcac2884d80dfe",
  "workdir": "/tmp/swebench_work/django__django-11039",
  "issue_text": "sqlmigrate wraps it's outpout in BEGIN/COMMIT even if the database doesn't support transactional DDL\nDescription\n\t \n\t\t(last modified by Simon Charette)\n\t \nThe migration executor only adds the outer BEGIN/COMMIT ​if the migration is atomic and ​the schema editor can rollback DDL but the current sqlmigrate logic only takes migration.atomic into consideration.\nThe issue can be addressed by\nChanging sqlmigrate ​assignment of self.output_transaction to consider connection.features.can_rollback_ddl as well.\nAdding a test in tests/migrations/test_commands.py based on ​an existing test for non-atomic migrations that mocks connection.features.can_rollback_ddl to False instead of overdidding MIGRATION_MODULES to point to a non-atomic migration.\nI marked the ticket as easy picking because I included the above guidelines but feel free to uncheck it if you deem it inappropriate.\n",
  "hints": {
    "failing_tests": [
      "test_sqlmigrate_for_non_transactional_databases (migrations.test_commands.MigrateTests)"
    ],
    "focus_files": [
      "django/core/management/commands/sqlmigrate.py"
    ],
    "test_patch": "diff --git a/tests/migrations/test_commands.py b/tests/migrations/test_commands.py\n--- a/tests/migrations/test_commands.py\n+++ b/tests/migrations/test_commands.py\n@@ -536,7 +536,13 @@ def test_sqlmigrate_forwards(self):\n         index_op_desc_unique_together = output.find('-- alter unique_together')\n         index_tx_end = output.find(connection.ops.end_transaction_sql().lower())\n \n-        self.assertGreater(index_tx_start, -1, \"Transaction start not found\")\n+        if connection.features.can_rollback_ddl:\n+            self.assertGreater(index_tx_start, -1, \"Transaction start not found\")\n+            self.assertGreater(\n+                index_tx_end, index_op_desc_unique_together,\n+                \"Transaction end not found or found before operation description (unique_together)\"\n+            )\n+\n         self.assertGreater(\n             index_op_desc_author, index_tx_start,\n             \"Operation description (author) not found or found before transaction start\"\n@@ -553,10 +559,6 @@ def test_sqlmigrate_forwards(self):\n             index_op_desc_unique_together, index_op_desc_tribble,\n             \"Operation description (unique_together) not found or found before operation description (tribble)\"\n         )\n-        self.assertGreater(\n-            index_tx_end, index_op_desc_unique_together,\n-            \"Transaction end not found or found before operation description (unique_together)\"\n-        )\n \n     @override_settings(MIGRATION_MODULES={\"migrations\": \"migrations.test_migrations\"})\n     def test_sqlmigrate_backwards(self):\n@@ -577,7 +579,12 @@ def test_sqlmigrate_backwards(self):\n         index_drop_table = output.rfind('drop table')\n         index_tx_end = output.find(connection.ops.end_transaction_sql().lower())\n \n-        self.assertGreater(index_tx_start, -1, \"Transaction start not found\")\n+        if connection.features.can_rollback_ddl:\n+            self.assertGreater(index_tx_start, -1, \"Transaction start not found\")\n+            self.assertGreater(\n+                index_tx_end, index_op_desc_unique_together,\n+                \"Transaction end not found or found before DROP TABLE\"\n+            )\n         self.assertGreater(\n             index_op_desc_unique_together, index_tx_start,\n             \"Operation description (unique_together) not found or found before transaction start\"\n@@ -595,10 +602,6 @@ def test_sqlmigrate_backwards(self):\n             index_drop_table, index_op_desc_author,\n             \"DROP TABLE not found or found before operation description (author)\"\n         )\n-        self.assertGreater(\n-            index_tx_end, index_op_desc_unique_together,\n-            \"Transaction end not found or found before DROP TABLE\"\n-        )\n \n         # Cleanup by unmigrating everything\n         call_command(\"migrate\", \"migrations\", \"zero\", verbosity=0)\n@@ -616,6 +619,22 @@ def test_sqlmigrate_for_non_atomic_migration(self):\n             self.assertNotIn(connection.ops.start_transaction_sql().lower(), queries)\n         self.assertNotIn(connection.ops.end_transaction_sql().lower(), queries)\n \n+    @override_settings(MIGRATION_MODULES={'migrations': 'migrations.test_migrations'})\n+    def test_sqlmigrate_for_non_transactional_databases(self):\n+        \"\"\"\n+        Transaction wrappers aren't shown for databases that don't support\n+        transactional DDL.\n+        \"\"\"\n+        out = io.StringIO()\n+        with mock.patch.object(connection.features, 'can_rollback_ddl', False):\n+            call_command('sqlmigrate', 'migrations', '0001', stdout=out)\n+        output = out.getvalue().lower()\n+        queries = [q.strip() for q in output.splitlines()]\n+        start_transaction_sql = connection.ops.start_transaction_sql()\n+        if start_transaction_sql:\n+            self.assertNotIn(start_transaction_sql.lower(), queries)\n+        self.assertNotIn(connection.ops.end_transaction_sql().lower(), queries)\n+\n     @override_settings(\n         INSTALLED_APPS=[\n             \"migrations.migrations_test_apps.migrated_app\",\n"
  },
  "commands": {
    "setup": [
      "pip install -e .[argon2,bcrypt]"
    ],
    "test_quick": "python -m pytest -x -q migrations/test_commands.py",
    "test_full": "python -m pytest -x -q migrations/test_commands.py"
  },
  "limits": {
    "max_iters": 8,
    "max_patch_bytes": 250000,
    "max_files_touched": 15,
    "max_new_files": 5,
    "max_runtime_sec": 1800
  }
}
