{
  "task_id": "scikit-learn__scikit-learn-10949",
  "repo_url": "https://github.com/scikit-learn/scikit-learn.git",
  "repo_ref": "3b5abf76597ce6aff76192869f92647c1b5259e7",
  "workdir": "/tmp/swebench_work/scikit-learn__scikit-learn-10949",
  "issue_text": "warn_on_dtype with DataFrame\n#### Description\r\n\r\n``warn_on_dtype`` has no effect when input is a pandas ``DataFrame``\r\n\r\n#### Steps/Code to Reproduce\r\n```python\r\nfrom sklearn.utils.validation import check_array\r\nimport pandas as pd\r\ndf = pd.DataFrame([[1, 2, 3], [2, 3, 4]], dtype=object)\r\nchecked = check_array(df, warn_on_dtype=True)\r\n```\r\n\r\n#### Expected result: \r\n\r\n```python-traceback\r\nDataConversionWarning: Data with input dtype object was converted to float64.\r\n```\r\n\r\n#### Actual Results\r\nNo warning is thrown\r\n\r\n#### Versions\r\nLinux-4.4.0-116-generic-x86_64-with-debian-stretch-sid\r\nPython 3.6.3 |Anaconda, Inc.| (default, Nov  3 2017, 19:19:16) \r\n[GCC 7.2.0]\r\nNumPy 1.13.1\r\nSciPy 0.19.1\r\nScikit-Learn 0.20.dev0\r\nPandas 0.21.0\r\n\nwarn_on_dtype with DataFrame\n#### Description\r\n\r\n``warn_on_dtype`` has no effect when input is a pandas ``DataFrame``\r\n\r\n#### Steps/Code to Reproduce\r\n```python\r\nfrom sklearn.utils.validation import check_array\r\nimport pandas as pd\r\ndf = pd.DataFrame([[1, 2, 3], [2, 3, 4]], dtype=object)\r\nchecked = check_array(df, warn_on_dtype=True)\r\n```\r\n\r\n#### Expected result: \r\n\r\n```python-traceback\r\nDataConversionWarning: Data with input dtype object was converted to float64.\r\n```\r\n\r\n#### Actual Results\r\nNo warning is thrown\r\n\r\n#### Versions\r\nLinux-4.4.0-116-generic-x86_64-with-debian-stretch-sid\r\nPython 3.6.3 |Anaconda, Inc.| (default, Nov  3 2017, 19:19:16) \r\n[GCC 7.2.0]\r\nNumPy 1.13.1\r\nSciPy 0.19.1\r\nScikit-Learn 0.20.dev0\r\nPandas 0.21.0\r\n\n",
  "hints": {
    "failing_tests": [
      "sklearn/utils/tests/test_validation.py::test_check_dataframe_warns_on_dtype"
    ],
    "focus_files": [
      "sklearn/utils/validation.py"
    ],
    "test_patch": "diff --git a/sklearn/utils/tests/test_validation.py b/sklearn/utils/tests/test_validation.py\n--- a/sklearn/utils/tests/test_validation.py\n+++ b/sklearn/utils/tests/test_validation.py\n@@ -7,6 +7,7 @@\n from itertools import product\n \n import pytest\n+from pytest import importorskip\n import numpy as np\n import scipy.sparse as sp\n from scipy import __version__ as scipy_version\n@@ -713,6 +714,38 @@ def test_suppress_validation():\n     assert_raises(ValueError, assert_all_finite, X)\n \n \n+def test_check_dataframe_warns_on_dtype():\n+    # Check that warn_on_dtype also works for DataFrames.\n+    # https://github.com/scikit-learn/scikit-learn/issues/10948\n+    pd = importorskip(\"pandas\")\n+\n+    df = pd.DataFrame([[1, 2, 3], [4, 5, 6]], dtype=object)\n+    assert_warns_message(DataConversionWarning,\n+                         \"Data with input dtype object were all converted to \"\n+                         \"float64.\",\n+                         check_array, df, dtype=np.float64, warn_on_dtype=True)\n+    assert_warns(DataConversionWarning, check_array, df,\n+                 dtype='numeric', warn_on_dtype=True)\n+    assert_no_warnings(check_array, df, dtype='object', warn_on_dtype=True)\n+\n+    # Also check that it raises a warning for mixed dtypes in a DataFrame.\n+    df_mixed = pd.DataFrame([['1', 2, 3], ['4', 5, 6]])\n+    assert_warns(DataConversionWarning, check_array, df_mixed,\n+                 dtype=np.float64, warn_on_dtype=True)\n+    assert_warns(DataConversionWarning, check_array, df_mixed,\n+                 dtype='numeric', warn_on_dtype=True)\n+    assert_warns(DataConversionWarning, check_array, df_mixed,\n+                 dtype=object, warn_on_dtype=True)\n+\n+    # Even with numerical dtypes, a conversion can be made because dtypes are\n+    # uniformized throughout the array.\n+    df_mixed_numeric = pd.DataFrame([[1., 2, 3], [4., 5, 6]])\n+    assert_warns(DataConversionWarning, check_array, df_mixed_numeric,\n+                 dtype='numeric', warn_on_dtype=True)\n+    assert_no_warnings(check_array, df_mixed_numeric.astype(int),\n+                       dtype='numeric', warn_on_dtype=True)\n+\n+\n class DummyMemory(object):\n     def cache(self, func):\n         return func\n"
  },
  "commands": {
    "setup": [
      "pip install -e .[tests]"
    ],
    "test_quick": "python -m pytest -x -q sklearn/utils/tests/test_validation.py::test_check_dataframe_warns_on_dtype",
    "test_full": "python -m pytest -x -q sklearn/utils/tests/test_validation.py::test_check_dataframe_warns_on_dtype"
  },
  "limits": {
    "max_iters": 8,
    "max_patch_bytes": 250000,
    "max_files_touched": 15,
    "max_new_files": 5,
    "max_runtime_sec": 1800
  }
}
